Timestamp	Agent_Phase	Action_Summary	Files_Changed	Linked_Decision_Node
2026-04-16T00:00:00Z	INSTALL	Initialized Agentic Brain memory graph and imported awesome-copilot core subset.	.github/agent_memory/*;.github/agentic_brain/vendor/awesome-copilot/*;.github/agentic_brain/catalog/*	01_decisions.md#memory-graph-contract
2026-05-01T19:57:46.960Z	installer:INSTALL	Installed Agentic Brain with core awesome-copilot subset for profile 'fullstack' and selected 256 required assets. CuratedFiles:13 IdeaSource:C:\Users\user\Desktop\Documentations\github\anti-private-equity-slop\PRD.md	.github/agentic_brain/vendor/awesome-copilot/{agents,instructions,skills,hooks,workflows,plugins};.github/agentic_brain/catalog/awesome-catalog.yaml;.github/agentic_brain/catalog/required-assets.yaml	01_decisions.md#memory-graph-contract
2026-05-01T20:30:00Z	installer:DOCS	Normalized Agentic Brain docs, created all PRD phase folders with README/CHECKLIST, and refreshed active dashboard + required agent/asset docs.	AGENTS/ACTIVE_PHASE.md;AGENTS/PROGRESS_DASHBOARD.md;AGENTS/REQUIRED_CUSTOM_AGENTS.md;AGENTS/REQUIRED_ASSETS.md;AGENTS/Phase 1 - Foundation/*;AGENTS/Phase 2 - Blacklist API and Sync/*;AGENTS/Phase 3 - UI Development/*;AGENTS/Phase 4 - Testing & Polish/*;AGENTS/Phase 5 - Deployment/*	01_decisions.md#memory-graph-contract
2026-05-01T20:40:00Z	curator:ASSET_IMPORT	Copied curated agents, hooks, and skills from vendor into runtime .github locations and updated framework docs.	.github/agents/*;.github/hooks/*;.github/skills/*;.github/workflows/README.md;AGENTS/ACTIVE_PHASE.md;AGENTS/PROGRESS_DASHBOARD.md;AGENTS/REQUIRED_CUSTOM_AGENTS.md	01_decisions.md#memory-graph-contract
2026-05-01T20:50:00Z	orchestrator:CHECKLIST_CURATION	Rewrote all five phase checklists with detailed asset-driven tasks mapped to curated agents, hooks, skills, and CI workflow gates.	AGENTS/Phase 1 - Foundation/CHECKLIST.md;AGENTS/Phase 2 - Blacklist API and Sync/CHECKLIST.md;AGENTS/Phase 3 - UI Development/CHECKLIST.md;AGENTS/Phase 4 - Testing & Polish/CHECKLIST.md;AGENTS/Phase 5 - Deployment/CHECKLIST.md	01_decisions.md#memory-graph-contract
2026-05-08T12:00:00Z	gem-orchestrator:Phase1	Loaded required memory and phase files as pre-flight for universal execution prompt.	.github/agent_memory/03_actions.tsv	01_decisions.md#memory-graph-contract
2026-05-08T12:45:49Z	gem-orchestrator:PHASE1_SECTION1	Completed Phase 1 checklist section 1 by defining checkpoints, owner sequence, failure rollback, evidence rules, and command contract; updated active/progress state and recorded command outcomes (build/test pass, lint pre-existing fail).	AGENTS/Phase 1 - Foundation/CHECKLIST.md;AGENTS/ACTIVE_PHASE.md;AGENTS/PROGRESS_DASHBOARD.md;.github/agent_memory/01_decisions.md	01_decisions.md#phase-1-checkpoint-governance-decision-2026-05-08
2026-05-08T13:02:24Z	installer:PHASE1_SECTION2	Completed Phase 1 checklist section 2 by validating AGENTS root doc integrity, aligning PRD phase names to canonical labels, confirming runtime .github asset population/documentation, and verifying catalog + placeholder checks; recorded command outcomes (build/test pass, lint pre-existing fail).	PRD.md;AGENTS/Phase 1 - Foundation/CHECKLIST.md;AGENTS/ACTIVE_PHASE.md;AGENTS/PROGRESS_DASHBOARD.md;.github/agent_memory/01_decisions.md	01_decisions.md#canonical-phase-naming-decision-2026-05-08
2026-05-08T13:12:48Z	curator:PHASE1_SECTION3	Completed Phase 1 checklist section 3 by validating required agent/hook/skill/workflow runtime paths, confirming no vendor-only required runtime gaps, and fixing checklist documentation drift (added missing playwright-tester reference); recorded command outcomes (build/test pass, lint pre-existing fail).	AGENTS/Phase 1 - Foundation/CHECKLIST.md;AGENTS/ACTIVE_PHASE.md;AGENTS/PROGRESS_DASHBOARD.md;.github/agent_memory/01_decisions.md;.github/agent_memory/02_learnings.md	01_decisions.md#curated-asset-source-of-truth-decision-2026-05-08
2026-05-08T14:44:38Z	api-architect:PHASE1_SECTION4	Completed Phase 1 checklist section 4 by codifying blacklist sync/message/failure contract boundaries in PRD section 5.2, updating checklist evidence, and handing ownership to TypeScript MCP Expert; recorded command outcomes (build/test pass, lint pre-existing fail).	PRD.md;AGENTS/Phase 1 - Foundation/CHECKLIST.md;AGENTS/ACTIVE_PHASE.md;AGENTS/PROGRESS_DASHBOARD.md;.github/agent_memory/01_decisions.md;.github/agent_memory/05_handoffs.tsv	01_decisions.md#foundation-contract-boundary-decision-2026-05-08
2026-05-13T10:49:31+03:00	typescript-mcp-expert:PHASE1_SECTION5	Completed Phase 1 checklist section 5 by documenting strict TS quality gate, runtime module boundaries, blacklist payload validation contract, and testability baseline in PRD section 5.2.5; updated phase state and handed ownership to Security Reviewer; recorded command outcomes (build/test pass, lint pre-existing fail).	PRD.md;AGENTS/Phase 1 - Foundation/CHECKLIST.md;AGENTS/ACTIVE_PHASE.md;AGENTS/PROGRESS_DASHBOARD.md;.github/agent_memory/01_decisions.md;.github/agent_memory/05_handoffs.tsv	01_decisions.md#type-and-runtime-baseline-decision-2026-05-13
